{
  "version": 1,
  "sourceLabel": "GRAVITY #151 / library source / OSS Whisper aligned",
  "selection": {
    "reason": "ライブラリの配信151.m4aから切り出した18.5秒をGitHub上でSHA-256照合し、whisper.cpp small/jaで再整列。認識の曖昧な前半を捨て、ADHD診断・100歳・遅くない・診断を受けていい、が連続する実測区間だけを採用。",
    "hook": "100歳でも、診断は遅くない",
    "summary": "ADHDの診断は高齢でも遅すぎることはない、という配信中の一節。"
  },
  "clip": {
    "startMs": 5760,
    "endMs": 18380
  },
  "layout": {
    "width": 1280,
    "height": 720,
    "captionBottomPx": 58,
    "background": "#0d1016"
  },
  "text": {
    "title": "100歳でも、診断は遅くない",
    "telop": "GRAVITY #151 / ADHDの話"
  },
  "captions": [
    {
      "startMs": 5760,
      "endMs": 7380,
      "speaker": "HOST",
      "text": "ADHDって診断されました",
      "speakerConfidence": 0.94,
      "speakerReason": "whisper.cpp実測トークン 5.76-7.38秒。文字化けした診断語尾のみ文脈補正。"
    },
    {
      "startMs": 7380,
      "endMs": 10160,
      "speaker": "HOST",
      "text": "100歳です、みたいな",
      "speakerConfidence": 0.96,
      "speakerReason": "whisper.cpp実測トークン 7.38-10.16秒。"
    },
    {
      "startMs": 10160,
      "endMs": 13360,
      "speaker": "HOST",
      "text": "あったんですよ",
      "speakerConfidence": 0.95,
      "speakerReason": "whisper.cpp実測トークン 10.16-13.36秒。"
    },
    {
      "startMs": 13360,
      "endMs": 14880,
      "speaker": "HOST",
      "text": "何も遅くないんですよ",
      "speakerConfidence": 0.90,
      "speakerReason": "whisper.cpp実測で『…くないんですよ』を確認。冒頭語のみ文脈補正。"
    },
    {
      "startMs": 14880,
      "endMs": 18380,
      "speaker": "HOST",
      "text": "もう100歳でも、そんな診断受けていいんで",
      "speakerConfidence": 0.96,
      "speakerReason": "whisper.cpp実測トークン 14.88-18.38秒。"
    }
  ],
  "motion": {
    "profile": "normal",
    "notes": "16:9横画面。説明口調なので過剰な身体モーションは避け、production Subeha.vrmの口形と小さな頭胸モーションを優先。"
  }
}
